{
  "id": "example.ui-generation.control-proximity-drift",
  "type": "example",
  "version": "1.0.0",
  "title": "Detached viewer controls moved back to the governed surface",
  "summary": "A resource browser places JSON and Schema controls in a different detail-zone than the code viewer they affect, then gets rewritten so the local controls live with the viewer.",
  "status": "active",
  "workflow_id": "workflow.ai-ui-generation",
  "guardrail_ids": ["guardrail.control-proximity"],
  "scenario": "A generated resource browser detail view places JSON and Schema buttons in an upper metadata band even though those controls switch the inline code viewer lower in the page, so the user has to infer which surface they govern.",
  "raw_output": "Keep the resource title, metadata cards, and JSON/Schema buttons together in the top details band. Put the code viewer further down the page. Add an Open raw JSON button beside the view toggle so all actions stay in one header cluster.",
  "verdict": {
    "verdict_id": "ver_008",
    "decision_id": "dec_008",
    "evaluated_at": "2026-04-11T00:00:00Z",
    "status": "warn",
    "severity": "medium",
    "guardrails_triggered": ["guardrail.control-proximity"],
    "reasons": [
      "the local view controls are detached from the code viewer they govern",
      "the header cluster mixes local viewer actions and cross-surface actions with the same ownership"
    ],
    "drift_score": 0.46,
    "recommended_action": "review",
    "rewrite_hint": "Move JSON and Schema into the local viewer toolbar directly above the code block. Keep any raw-file action outside that cluster unless it is clearly secondary.",
    "ownership": {
      "decision_owner": "Design Systems",
      "risk_owner": "Product",
      "operational_owner": "Frontend Platform"
    },
    "incident_required": false
  },
  "corrected_output": "Place the JSON and Schema toggle in the viewer toolbar directly above the code block so the local controls sit with the governed surface. Keep Open raw JSON outside that cluster unless it is visually secondary and clearly a separate cross-surface action.",
  "lesson": "Generated UI should colocate local controls with the surface they change. Proximity clarifies ownership before the user has to read or infer anything else.",
  "links": {
    "docs_url": "https://judgmentkit.ai/docs/examples/control-proximity-drift",
    "markdown_url": "https://judgmentkit.ai/docs/examples/control-proximity-drift.md",
    "schema_url": "https://judgmentkit.ai/schemas/example.schema.json"
  },
  "last_reviewed": "2026-04-11"
}
